{"system": "c2me-26.2", "display_name": "C2ME", "stage": "hc-e6/zen5", "wall_s": 3.355, "chunks": [{"cx": 0, "cz": 1, "t_done_ms": 118.329, "t_stage1_ms": 118.277}, {"cx": 1, "cz": 0, "t_done_ms": 118.58, "t_stage1_ms": 118.53}, {"cx": 0, "cz": 0, "t_done_ms": 121.297, "t_stage1_ms": 121.29}, {"cx": 1, "cz": 1, "t_done_ms": 122.413, "t_stage1_ms": 122.406}, {"cx": 1, "cz": 2, "t_done_ms": 450.956, "t_stage1_ms": 122.932}, {"cx": 2, "cz": 1, "t_done_ms": 458.563, "t_stage1_ms": 123.37}, {"cx": 2, "cz": 2, "t_done_ms": 463.129, "t_stage1_ms": 123.449}, {"cx": 2, "cz": 0, "t_done_ms": 475.581, "t_stage1_ms": 123.261}, {"cx": 0, "cz": 2, "t_done_ms": 491.11, "t_stage1_ms": 121.964}, {"cx": 1, "cz": 3, "t_done_ms": 507.083, "t_stage1_ms": 418.201}, {"cx": 2, "cz": 3, "t_done_ms": 511.654, "t_stage1_ms": 414.72}, {"cx": 0, "cz": 3, "t_done_ms": 517.313, "t_stage1_ms": 415.106}, {"cx": 3, "cz": 0, "t_done_ms": 524.742, "t_stage1_ms": 427.346}, {"cx": 2, "cz": 4, "t_done_ms": 633.208, "t_stage1_ms": 499.903}, {"cx": 3, "cz": 1, "t_done_ms": 640.582, "t_stage1_ms": 415.529}, {"cx": 3, "cz": 2, "t_done_ms": 653.582, "t_stage1_ms": 418.841}, {"cx": 1, "cz": 4, "t_done_ms": 661.539, "t_stage1_ms": 498.668}, {"cx": 0, "cz": 4, "t_done_ms": 665.487, "t_stage1_ms": 498.075}, {"cx": 3, "cz": 3, "t_done_ms": 672.212, "t_stage1_ms": 436.222}, {"cx": 3, "cz": 4, "t_done_ms": 727.643, "t_stage1_ms": 499.367}, {"cx": 3, "cz": 5, "t_done_ms": 743.581, "t_stage1_ms": 545.424}, {"cx": 0, "cz": 5, "t_done_ms": 744.469, "t_stage1_ms": 656.65}, {"cx": 1, "cz": 5, "t_done_ms": 750.205, "t_stage1_ms": 545.572}, {"cx": 2, "cz": 5, "t_done_ms": 753.752, "t_stage1_ms": 628.603}, {"cx": 0, "cz": 7, "t_done_ms": 761.168, "t_stage1_ms": 702.738}, {"cx": 1, "cz": 6, "t_done_ms": 766.766, "t_stage1_ms": 736.62}, {"cx": 3, "cz": 6, "t_done_ms": 772.253, "t_stage1_ms": 666.959}, {"cx": 0, "cz": 6, "t_done_ms": 772.471, "t_stage1_ms": 682.404}, {"cx": 2, "cz": 6, "t_done_ms": 776.324, "t_stage1_ms": 736.358}, {"cx": 1, "cz": 7, "t_done_ms": 780.049, "t_stage1_ms": 704.705}, {"cx": 2, "cz": 7, "t_done_ms": 785.39, "t_stage1_ms": 752.366}, {"cx": 0, "cz": 8, "t_done_ms": 796.597, "t_stage1_ms": 734.556}, {"cx": 1, "cz": 8, "t_done_ms": 801.954, "t_stage1_ms": 735.82}, {"cx": 2, "cz": 8, "t_done_ms": 807.633, "t_stage1_ms": 774.269}, {"cx": 3, "cz": 7, "t_done_ms": 811.766, "t_stage1_ms": 749.556}, {"cx": 1, "cz": 9, "t_done_ms": 817.027, "t_stage1_ms": 773.634}, {"cx": 0, "cz": 9, "t_done_ms": 821.283, "t_stage1_ms": 773.645}, {"cx": 3, "cz": 8, "t_done_ms": 822.328, "t_stage1_ms": 776.696}, {"cx": 2, "cz": 9, "t_done_ms": 826.052, "t_stage1_ms": 788.449}, {"cx": 2, "cz": 10, "t_done_ms": 833.276, "t_stage1_ms": 806.353}, {"cx": 1, "cz": 10, "t_done_ms": 840.463, "t_stage1_ms": 807.127}, {"cx": 0, "cz": 10, "t_done_ms": 848.917, "t_stage1_ms": 801.876}, {"cx": 3, "cz": 9, "t_done_ms": 850.071, "t_stage1_ms": 789.616}, {"cx": 2, "cz": 11, "t_done_ms": 855.706, "t_stage1_ms": 826.809}, {"cx": 1, "cz": 11, "t_done_ms": 862.775, "t_stage1_ms": 826.593}, {"cx": 0, "cz": 11, "t_done_ms": 871.66, "t_stage1_ms": 825.512}, {"cx": 3, "cz": 10, "t_done_ms": 872.38, "t_stage1_ms": 812.398}, {"cx": 3, "cz": 11, "t_done_ms": 875.921, "t_stage1_ms": 827.293}, {"cx": 0, "cz": 12, "t_done_ms": 879.581, "t_stage1_ms": 845.766}, {"cx": 1, "cz": 12, "t_done_ms": 884.381, "t_stage1_ms": 841.765}, {"cx": 2, "cz": 12, "t_done_ms": 887.68, "t_stage1_ms": 844.561}, {"cx": 2, "cz": 13, "t_done_ms": 891.149, "t_stage1_ms": 873.252}, {"cx": 3, "cz": 12, "t_done_ms": 893.333, "t_stage1_ms": 843.34}, {"cx": 0, "cz": 13, "t_done_ms": 896.821, "t_stage1_ms": 872.954}, {"cx": 1, "cz": 13, "t_done_ms": 900.303, "t_stage1_ms": 873.163}, {"cx": 3, "cz": 13, "t_done_ms": 905.215, "t_stage1_ms": 873.436}, {"cx": 2, "cz": 14, "t_done_ms": 911.358, "t_stage1_ms": 887.712}, {"cx": 1, "cz": 14, "t_done_ms": 915.741, "t_stage1_ms": 887.544}, {"cx": 3, "cz": 14, "t_done_ms": 918.003, "t_stage1_ms": 887.519}, {"cx": 0, "cz": 14, "t_done_ms": 922.479, "t_stage1_ms": 891.646}, {"cx": 3, "cz": 15, "t_done_ms": 930.985, "t_stage1_ms": 908.784}, {"cx": 2, "cz": 15, "t_done_ms": 934.173, "t_stage1_ms": 908.5}, {"cx": 1, "cz": 15, "t_done_ms": 939.974, "t_stage1_ms": 908.543}, {"cx": 0, "cz": 15, "t_done_ms": 946.38, "t_stage1_ms": 912.108}, {"cx": 1, "cz": 16, "t_done_ms": 958.086, "t_stage1_ms": 931.558}, {"cx": 2, "cz": 16, "t_done_ms": 959.974, "t_stage1_ms": 928.467}, {"cx": 3, "cz": 16, "t_done_ms": 963.281, "t_stage1_ms": 926.615}, {"cx": 0, "cz": 16, "t_done_ms": 968.713, "t_stage1_ms": 926.545}, {"cx": 1, "cz": 17, "t_done_ms": 972.044, "t_stage1_ms": 948.046}, {"cx": 2, "cz": 17, "t_done_ms": 974.634, "t_stage1_ms": 950.333}, {"cx": 3, "cz": 17, "t_done_ms": 979.892, "t_stage1_ms": 950.902}, {"cx": 0, "cz": 17, "t_done_ms": 980.713, "t_stage1_ms": 948.14}, {"cx": 3, "cz": 18, "t_done_ms": 993.016, "t_stage1_ms": 964.163}, {"cx": 0, "cz": 18, "t_done_ms": 998.096, "t_stage1_ms": 967.054}, {"cx": 2, "cz": 18, "t_done_ms": 1002.405, "t_stage1_ms": 964.317}, {"cx": 1, "cz": 18, "t_done_ms": 1005.475, "t_stage1_ms": 967.841}, {"cx": 4, "cz": 2, "t_done_ms": 1028.101, "t_stage1_ms": 637.555}, {"cx": 4, "cz": 5, "t_done_ms": 1028.111, "t_stage1_ms": 722.942}, {"cx": 4, "cz": 3, "t_done_ms": 1033.464, "t_stage1_ms": 648.087}, {"cx": 4, "cz": 6, "t_done_ms": 1033.793, "t_stage1_ms": 720.782}, {"cx": 4, "cz": 4, "t_done_ms": 1037.343, "t_stage1_ms": 667.278}, {"cx": 4, "cz": 1, "t_done_ms": 1038.391, "t_stage1_ms": 518.328}, {"cx": 4, "cz": 7, "t_done_ms": 1039.887, "t_stage1_ms": 766.738}, {"cx": 4, "cz": 0, "t_done_ms": 1040.3, "t_stage1_ms": 520.745}, {"cx": 4, "cz": 11, "t_done_ms": 1042.192, "t_stage1_ms": 845.891}, {"cx": 4, "cz": 8, "t_done_ms": 1042.68, "t_stage1_ms": 798.398}, {"cx": 4, "cz": 13, "t_done_ms": 1045.738, "t_stage1_ms": 888.357}, {"cx": 4, "cz": 16, "t_done_ms": 1047.46, "t_stage1_ms": 926.652}, {"cx": 4, "cz": 9, "t_done_ms": 1048.863, "t_stage1_ms": 798.297}, {"cx": 4, "cz": 12, "t_done_ms": 1051.575, "t_stage1_ms": 853.969}, {"cx": 4, "cz": 15, "t_done_ms": 1052.182, "t_stage1_ms": 912.857}, {"cx": 4, "cz": 14, "t_done_ms": 1055.119, "t_stage1_ms": 900.834}, {"cx": 4, "cz": 17, "t_done_ms": 1056.659, "t_stage1_ms": 949.66}, {"cx": 4, "cz": 10, "t_done_ms": 1057.576, "t_stage1_ms": 841.697}, {"cx": 5, "cz": 2, "t_done_ms": 1061.952, "t_stage1_ms": 1023.968}, {"cx": 5, "cz": 4, "t_done_ms": 1065.219, "t_stage1_ms": 1022.377}, {"cx": 5, "cz": 3, "t_done_ms": 1069.096, "t_stage1_ms": 1018.652}, {"cx": 5, "cz": 1, "t_done_ms": 1071.029, "t_stage1_ms": 1022.952}, {"cx": 5, "cz": 0, "t_done_ms": 1073.226, "t_stage1_ms": 1023.913}, {"cx": 5, "cz": 5, "t_done_ms": 1074.636, "t_stage1_ms": 1024.271}, {"cx": 5, "cz": 8, "t_done_ms": 1075.301, "t_stage1_ms": 1030.589}, {"cx": 5, "cz": 13, "t_done_ms": 1079.227, "t_stage1_ms": 1039.866}, {"cx": 5, "cz": 9, "t_done_ms": 1079.588, "t_stage1_ms": 1038.841}, {"cx": 4, "cz": 18, "t_done_ms": 1080.052, "t_stage1_ms": 975.468}, {"cx": 5, "cz": 6, "t_done_ms": 1081.299, "t_stage1_ms": 1018.759}, {"cx": 5, "cz": 7, "t_done_ms": 1084.272, "t_stage1_ms": 1024.998}, {"cx": 5, "cz": 10, "t_done_ms": 1085.52, "t_stage1_ms": 1033.512}, {"cx": 5, "cz": 11, "t_done_ms": 1088.045, "t_stage1_ms": 1038.055}, {"cx": 5, "cz": 14, "t_done_ms": 1089.195, "t_stage1_ms": 1039.858}, {"cx": 5, "cz": 15, "t_done_ms": 1092.323, "t_stage1_ms": 1040.752}, {"cx": 5, "cz": 12, "t_done_ms": 1097.645, "t_stage1_ms": 1036.227}, {"cx": 5, "cz": 17, "t_done_ms": 1098.821, "t_stage1_ms": 1042.742}, {"cx": 6, "cz": 3, "t_done_ms": 1099.882, "t_stage1_ms": 1054.392}, {"cx": 5, "cz": 16, "t_done_ms": 1100.594, "t_stage1_ms": 1040.737}, {"cx": 6, "cz": 0, "t_done_ms": 1101.377, "t_stage1_ms": 1058.661}, {"cx": 5, "cz": 18, "t_done_ms": 1103.734, "t_stage1_ms": 1048.484}, {"cx": 6, "cz": 2, "t_done_ms": 1105.79, "t_stage1_ms": 1053.644}, {"cx": 6, "cz": 1, "t_done_ms": 1109.852, "t_stage1_ms": 1058.195}, {"cx": 6, "cz": 4, "t_done_ms": 1110.051, "t_stage1_ms": 1059.282}, {"cx": 6, "cz": 9, "t_done_ms": 1111.445, "t_stage1_ms": 1071.366}, {"cx": 6, "cz": 10, "t_done_ms": 1115.433, "t_stage1_ms": 1074.212}, {"cx": 6, "cz": 7, "t_done_ms": 1115.504, "t_stage1_ms": 1072.195}, {"cx": 6, "cz": 8, "t_done_ms": 1118.48, "t_stage1_ms": 1070.009}, {"cx": 6, "cz": 11, "t_done_ms": 1120.083, "t_stage1_ms": 1077.28}, {"cx": 6, "cz": 12, "t_done_ms": 1123.409, "t_stage1_ms": 1074.662}, {"cx": 6, "cz": 14, "t_done_ms": 1126.674, "t_stage1_ms": 1076.531}, {"cx": 6, "cz": 5, "t_done_ms": 1130.047, "t_stage1_ms": 1058.218}, {"cx": 6, "cz": 16, "t_done_ms": 1130.593, "t_stage1_ms": 1075.323}, {"cx": 7, "cz": 2, "t_done_ms": 1132.338, "t_stage1_ms": 1096.09}, {"cx": 6, "cz": 17, "t_done_ms": 1132.56, "t_stage1_ms": 1092.917}, {"cx": 6, "cz": 6, "t_done_ms": 1133.112, "t_stage1_ms": 1071.061}, {"cx": 6, "cz": 13, "t_done_ms": 1135.805, "t_stage1_ms": 1074.338}, {"cx": 6, "cz": 15, "t_done_ms": 1138.162, "t_stage1_ms": 1077.425}, {"cx": 7, "cz": 1, "t_done_ms": 1138.925, "t_stage1_ms": 1094.326}, {"cx": 7, "cz": 4, "t_done_ms": 1141.615, "t_stage1_ms": 1093.368}, {"cx": 6, "cz": 18, "t_done_ms": 1143.905, "t_stage1_ms": 1092.166}, {"cx": 7, "cz": 7, "t_done_ms": 1145.923, "t_stage1_ms": 1111.201}, {"cx": 7, "cz": 3, "t_done_ms": 1146.572, "t_stage1_ms": 1093.2}, {"cx": 7, "cz": 0, "t_done_ms": 1147.577, "t_stage1_ms": 1091.757}, {"cx": 7, "cz": 6, "t_done_ms": 1148.953, "t_stage1_ms": 1111.624}, {"cx": 7, "cz": 9, "t_done_ms": 1151.126, "t_stage1_ms": 1107.609}, {"cx": 7, "cz": 5, "t_done_ms": 1152.331, "t_stage1_ms": 1104.316}, {"cx": 7, "cz": 8, "t_done_ms": 1152.877, "t_stage1_ms": 1107.91}, {"cx": 7, "cz": 11, "t_done_ms": 1156.782, "t_stage1_ms": 1111.236}, {"cx": 7, "cz": 13, "t_done_ms": 1160.598, "t_stage1_ms": 1109.803}, {"cx": 7, "cz": 14, "t_done_ms": 1162.333, "t_stage1_ms": 1121.737}, {"cx": 7, "cz": 15, "t_done_ms": 1164.705, "t_stage1_ms": 1121.383}, {"cx": 7, "cz": 16, "t_done_ms": 1166.8